Macropad HID dump 1/24/2025

pi@raspberrypi4:~ $ sudo usbhid-dump -a1:7  | grep -v : | xxd -r -p | hidrd-convert -o spec

Usage Page (FF31h),                         ; FF31h, vendor-defined
Usage (74h),
Collection (Application),
    Usage (75h),
    Logical Minimum (0),
    Logical Maximum (255),
    Report Count (32),
    Report Size (8),
    Input (Variable),
End Collection,
Usage Page (Desktop),                       ; Generic desktop controls (01h)
Usage (Mouse),                              ; Mouse (02h, application collection)
Collection (Application),
    Report ID (2),
    Usage (Pointer),                        ; Pointer (01h, physical collection)
    Collection (Physical),
        Usage Page (Button),                ; Button (09h)
        Usage Minimum (01h),
        Usage Maximum (08h),
        Logical Minimum (0),
        Logical Maximum (1),
        Report Count (8),
        Report Size (1),
        Input (Variable),
        Usage Page (Desktop),               ; Generic desktop controls (01h)
        Usage (X),                          ; X (30h, dynamic value)
        Usage (Y),                          ; Y (31h, dynamic value)
        Logical Minimum (-127),
        Logical Maximum (127),
        Report Count (2),
        Report Size (8),
        Input (Variable, Relative),
        Usage (Wheel),                      ; Wheel (38h, dynamic value)
        Logical Minimum (-127),
        Logical Maximum (127),
        Report Count (1),
        Report Size (8),
        Input (Variable, Relative),
        Usage Page (Consumer),              ; Consumer (0Ch)
        Usage (AC Pan),                     ; AC pan (0238h, linear control)
        Logical Minimum (-127),
        Logical Maximum (127),
        Report Count (1),
        Report Size (8),
        Input (Variable, Relative),
    End Collection,
End Collection,
Usage Page (Desktop),                       ; Generic desktop controls (01h)
Usage (Sys Control),                        ; System control (80h, application collection)
Collection (Application),
    Report ID (3),
    Usage Minimum (Pointer),                ; Pointer (01h, physical collection)
    Usage Maximum (Sys Dspl LCD Autoscale), ; System display LCD autoscale (B7h, one-shot control)
    Logical Minimum (1),
    Logical Maximum (183),
    Report Count (1),
    Report Size (16),
    Input,
End Collection,
Usage Page (Consumer),                      ; Consumer (0Ch)
Usage (Consumer Control),                   ; Consumer control (01h, application collection)
Collection (Application),
    Report ID (4),
    Usage Minimum (Consumer Control),       ; Consumer control (01h, application collection)
    Usage Maximum (02A0h),
    Logical Minimum (1),
    Logical Maximum (672),
    Report Count (1),
    Report Size (16),
    Input,
End Collection,
Usage Page (Desktop),                       ; Generic desktop controls (01h)
Usage (Keyboard),                           ; Keyboard (06h, application collection)
Collection (Application),
    Report ID (6),
    Usage Page (Keyboard),                  ; Keyboard/keypad (07h)
    Usage Minimum (KB Leftcontrol),         ; Keyboard left control (E0h, dynamic value)
    Usage Maximum (KB Right GUI),           ; Keyboard right GUI (E7h, dynamic value)
    Logical Minimum (0),
    Logical Maximum (1),
    Report Count (8),
    Report Size (1),
    Input (Variable),
    Usage Page (Keyboard),                  ; Keyboard/keypad (07h)
    Usage Minimum (None),                   ; No event (00h, selector)
    Usage Maximum (EFh),
    Logical Minimum (0),
    Logical Maximum (1),
    Report Count (240),
    Report Size (1),
    Input (Variable),
    Usage Page (LED),                       ; LEDs (08h)
    Usage Minimum (01h),
    Usage Maximum (05h),
    Report Count (5),
    Report Size (1),
    Output (Variable),
    Report Count (1),
    Report Size (3),
    Output (Constant),
End Collection,
Usage Page (Desktop),                       ; Generic desktop controls (01h)
Usage (Keyboard),                           ; Keyboard (06h, application collection)
Collection (Application),
    Usage Page (Keyboard),                  ; Keyboard/keypad (07h)
    Usage Minimum (KB Leftcontrol),         ; Keyboard left control (E0h, dynamic value)
    Usage Maximum (KB Right GUI),           ; Keyboard right GUI (E7h, dynamic value)
    Logical Minimum (0),
    Logical Maximum (1),
    Report Count (8),
    Report Size (1),
    Input (Variable),
    Report Count (1),
    Report Size (8),
    Input (Constant),
    Usage Page (Keyboard),                  ; Keyboard/keypad (07h)
    Usage Minimum (None),                   ; No event (00h, selector)
    Usage Maximum (FFh),
    Logical Minimum (0),
    Logical Maximum (255),
    Report Count (6),
    Report Size (8),
    Input,
    Usage Page (LED),                       ; LEDs (08h)
    Usage Minimum (01h),
    Usage Maximum (05h),
    Logical Minimum (0),
    Logical Maximum (1),
    Report Count (5),
    Report Size (1),
    Output (Variable),
    Report Count (1),
    Report Size (3),
    Output (Constant),
End Collection


The raw data:

001:007:002:DESCRIPTOR         1737771035.965531
 06 31 FF 09 74 A1 01 09 75 15 00 26 FF 00 95 20
 75 08 81 02 C0

001:007:001:DESCRIPTOR         1737771035.973188
 05 01 09 02 A1 01 85 02 09 01 A1 00 05 09 19 01
 29 08 15 00 25 01 95 08 75 01 81 02 05 01 09 30
 09 31 15 81 25 7F 95 02 75 08 81 06 09 38 15 81
 25 7F 95 01 75 08 81 06 05 0C 0A 38 02 15 81 25
 7F 95 01 75 08 81 06 C0 C0 05 01 09 80 A1 01 85
 03 19 01 2A B7 00 15 01 26 B7 00 95 01 75 10 81
 00 C0 05 0C 09 01 A1 01 85 04 19 01 2A A0 02 15
 01 26 A0 02 95 01 75 10 81 00 C0 05 01 09 06 A1
 01 85 06 05 07 19 E0 29 E7 15 00 25 01 95 08 75
 01 81 02 05 07 19 00 29 EF 15 00 25 01 95 F0 75
 01 81 02 05 08 19 01 29 05 95 05 75 01 91 02 95
 01 75 03 91 01 C0

001:007:000:DESCRIPTOR         1737771035.975754
 05 01 09 06 A1 01 05 07 19 E0 29 E7 15 00 25 01
 95 08 75 01 81 02 95 01 75 08 81 01 05 07 19 00
 29 FF 15 00 26 FF 00 95 06 75 08 81 00 05 08 19
 01 29 05 15 00 25 01 95 05 75 01 91 02 95 01 75
 03 91 01 C0
