MLS_PROG_BUTTONS Dump 1/25/2025

sudo usbhid-dump -a1:7  | grep -v : | xxd -r -p | hidrd-convert -o spec

Usage Page (Consumer),              ; Consumer (0Ch)
Usage (Consumer Control),           ; Consumer control (01h, application collection)
Collection (Application),
    Report ID (5),
    Usage (Programmable Buttons),   ; Programmable buttons (03h, named array)
    Collection (Named Array),
        Usage Page (Button),        ; Button (09h)
        Usage Minimum (01h),
        Usage Maximum (20h),
        Logical Minimum (0),
        Logical Maximum (1),
        Report Count (32),
        Report Size (1),
        Input (Variable),
    End Collection,
End Collection,
Usage Page (Desktop),               ; Generic desktop controls (01h)
Usage (Keyboard),                   ; Keyboard (06h, application collection)
Collection (Application),
    Usage Page (Keyboard),          ; Keyboard/keypad (07h)
    Usage Minimum (KB Leftcontrol), ; Keyboard left control (E0h, dynamic value)
    Usage Maximum (KB Right GUI),   ; Keyboard right GUI (E7h, dynamic value)
    Logical Minimum (0),
    Logical Maximum (1),
    Report Count (8),
    Report Size (1),
    Input (Variable),
    Report Count (1),
    Report Size (8),
    Input (Constant),
    Usage Page (Keyboard),          ; Keyboard/keypad (07h)
    Usage Minimum (None),           ; No event (00h, selector)
    Usage Maximum (FFh),
    Logical Minimum (0),
    Logical Maximum (255),
    Report Count (6),
    Report Size (8),
    Input,
    Usage Page (LED),               ; LEDs (08h)
    Usage Minimum (01h),
    Usage Maximum (05h),
    Logical Minimum (0),
    Logical Maximum (1),
    Report Count (5),
    Report Size (1),
    Output (Variable),
    Report Count (1),
    Report Size (3),
    Output (Constant),
End Collection


sudo usbhid-dump -a1:7

001:007:001:DESCRIPTOR         1737833859.853194
 05 0C 09 01 A1 01 85 05 09 03 A1 04 05 09 19 01
 29 20 15 00 25 01 95 20 75 01 81 02 C0 C0

001:007:000:DESCRIPTOR         1737833859.855202
 05 01 09 06 A1 01 05 07 19 E0 29 E7 15 00 25 01
 95 08 75 01 81 02 95 01 75 08 81 01 05 07 19 00
 29 FF 15 00 26 FF 00 95 06 75 08 81 00 05 08 19
 01 29 05 15 00 25 01 95 05 75 01 91 02 95 01 75
 03 91 01 C0

