MLSPedal1 HID dump 1/24/2025

pi@raspberrypi4:~ $ sudo usbhid-dump -a1:15  | grep -v : | xxd -r -p | hidrd-convert -o spec

Usage Page (Desktop),               ; Generic desktop controls (01h)
Usage (Mouse),                      ; Mouse (02h, application collection)
Collection (Application),
    Report ID (2),
    Usage (Pointer),                ; Pointer (01h, physical collection)
    Collection (Physical),
        Usage Page (Button),        ; Button (09h)
        Usage Minimum (01h),
        Usage Maximum (08h),
        Logical Minimum (0),
        Logical Maximum (1),
        Report Count (8),
        Report Size (1),
        Input (Variable),
        Usage Page (Desktop),       ; Generic desktop controls (01h)
        Usage (X),                  ; X (30h, dynamic value)
        Usage (Y),                  ; Y (31h, dynamic value)
        Logical Minimum (-127),
        Logical Maximum (127),
        Report Count (2),
        Report Size (8),
        Input (Variable, Relative),
        Usage (Wheel),              ; Wheel (38h, dynamic value)
        Logical Minimum (-127),
        Logical Maximum (127),
        Report Count (1),
        Report Size (8),
        Input (Variable, Relative),
        Usage Page (Consumer),      ; Consumer (0Ch)
        Usage (AC Pan),             ; AC pan (0238h, linear control)
        Logical Minimum (-127),
        Logical Maximum (127),
        Report Count (1),
        Report Size (8),
        Input (Variable, Relative),
    End Collection,
End Collection,
Usage Page (Desktop),               ; Generic desktop controls (01h)
Usage (Keyboard),                   ; Keyboard (06h, application collection)
Collection (Application),
    Usage Page (Keyboard),          ; Keyboard/keypad (07h)
    Usage Minimum (KB Leftcontrol), ; Keyboard left control (E0h, dynamic value)
    Usage Maximum (KB Right GUI),   ; Keyboard right GUI (E7h, dynamic value)
    Logical Minimum (0),
    Logical Maximum (1),
    Report Count (8),
    Report Size (1),
    Input (Variable),
    Report Count (1),
    Report Size (8),
    Input (Constant),
    Usage Page (Keyboard),          ; Keyboard/keypad (07h)
    Usage Minimum (None),           ; No event (00h, selector)
    Usage Maximum (FFh),
    Logical Minimum (0),
    Logical Maximum (255),
    Report Count (6),
    Report Size (8),
    Input,
    Usage Page (LED),               ; LEDs (08h)
    Usage Minimum (01h),
    Usage Maximum (05h),
    Logical Minimum (0),
    Logical Maximum (1),
    Report Count (5),
    Report Size (1),
    Output (Variable),
    Report Count (1),
    Report Size (3),
    Output (Constant),
End Collection



The raw data:

sudo usbhid-dump -a1:15

001:015:001:DESCRIPTOR         1737778347.555510
 05 01 09 02 A1 01 85 02 09 01 A1 00 05 09 19 01
 29 08 15 00 25 01 95 08 75 01 81 02 05 01 09 30
 09 31 15 81 25 7F 95 02 75 08 81 06 09 38 15 81
 25 7F 95 01 75 08 81 06 05 0C 0A 38 02 15 81 25
 7F 95 01 75 08 81 06 C0 C0

001:015:000:DESCRIPTOR         1737778347.558245
 05 01 09 06 A1 01 05 07 19 E0 29 E7 15 00 25 01
 95 08 75 01 81 02 95 01 75 08 81 01 05 07 19 00
 29 FF 15 00 26 FF 00 95 06 75 08 81 00 05 08 19
 01 29 05 15 00 25 01 95 05 75 01 91 02 95 01 75
 03 91 01 C0
